{
  "schemaVersion": 1,
  "id": "fumadocs-knowledge-base",
  "title": "Fumadocs · Agent-ready Knowledge Base",
  "summary": "Create a useful, static-first documentation architecture with accessible components, verified guides, navigable tasks and agent-friendly API docs.",
  "items": [
    {
      "id": "fumadocs-ui"
    },
    {
      "id": "fumadocs-starter",
      "note": "Optional, explicit new-project scaffold; not automatically executed"
    },
    {
      "id": "docs-architect"
    },
    {
      "id": "fumadocs-engineer"
    },
    {
      "id": "api-documentation-quality"
    },
    {
      "id": "prompt-quality-reviewer"
    },
    {
      "id": "compozy-fumadocs",
      "note": "Upstream skill reference, review before opt-in use"
    },
    {
      "id": "diataxis-docs-framework",
      "note": "Upstream skill reference, review before opt-in use"
    },
    {
      "id": "adk-docs-writer",
      "note": "Upstream skill reference, review before opt-in use"
    }
  ]
}
